{
  "schema_version": "1.0.0",
  "analysis_type": "inclusive_wealth_human_development_distribution",
  "id": "example-inclusive-development",
  "title": "Inclusive wealth, human development, and distribution",
  "summary": [
    {
      "analysis_id": "example-inclusive-development",
      "closing_inclusive_wealth": 1627.6,
      "inclusive_wealth_change": 197.5999999999999,
      "closing_per_capita_wealth": 307.0943396226415,
      "adjusted_net_savings": 93,
      "human_development_index": 0.7789141457589414,
      "gini": 0.3011764705882354,
      "share_below_social_floor": 0.2,
      "non_declining_per_capita_wealth": true,
      "composite_score": 61.72175112993635
    }
  ],
  "wealth": {
    "schema_version": "1.0.0",
    "id": "inclusive-wealth",
    "title": "Inclusive wealth account",
    "data": [
      {
        "entity": "Example region",
        "time": 2025,
        "produced_capital_value": 535,
        "human_capital_value": 508.8,
        "natural_capital_value": 447,
        "inclusive_wealth": 1490.8,
        "opening_inclusive_wealth": 1430,
        "inclusive_wealth_change": 60.799999999999955,
        "produced_share": 0.35886772202844114,
        "human_share": 0.34129326536088006,
        "natural_share": 0.29983901261067886,
        "population": 5,
        "inclusive_wealth_per_capita": 298.15999999999997,
        "currency": "index",
        "price_basis": "declared_shadow_prices"
      },
      {
        "entity": "Example region",
        "time": 2030,
        "produced_capital_value": 570,
        "human_capital_value": 540,
        "natural_capital_value": 445.5,
        "inclusive_wealth": 1555.5,
        "opening_inclusive_wealth": 1490.8,
        "inclusive_wealth_change": 64.70000000000005,
        "produced_share": 0.36644165863066536,
        "human_share": 0.3471552555448409,
        "natural_share": 0.28640308582449375,
        "population": 5.15,
        "inclusive_wealth_per_capita": 302.0388349514563,
        "currency": "index",
        "price_basis": "declared_shadow_prices"
      },
      {
        "entity": "Example region",
        "time": 2035,
        "produced_capital_value": 607,
        "human_capital_value": 573.6,
        "natural_capital_value": 447,
        "inclusive_wealth": 1627.6,
        "opening_inclusive_wealth": 1555.5,
        "inclusive_wealth_change": 72.09999999999991,
        "produced_share": 0.37294175473089214,
        "human_share": 0.35242074219710007,
        "natural_share": 0.2746375030720079,
        "population": 5.3,
        "inclusive_wealth_per_capita": 307.0943396226415,
        "currency": "index",
        "price_basis": "declared_shadow_prices"
      }
    ],
    "capital_accounts": {
      "produced": {
        "schema_version": "1.0.0",
        "id": "produced-capital",
        "title": "Produced capital account",
        "capital_type": "produced",
        "unit": "wealth_index",
        "data": [
          {
            "entity": "Example region",
            "time": 2025,
            "capital_type": "produced",
            "opening_stock": 500,
            "investment": 55,
            "revaluation": 0,
            "depreciation": 20,
            "depletion": 0,
            "damages": 0,
            "expected_closing_stock": 535,
            "closing_stock": 535,
            "net_change": 35,
            "accounting_net_change": 35,
            "reconciliation_error": 0,
            "shadow_price": 1,
            "opening_value": 500,
            "closing_value": 535,
            "value_change": 35,
            "unit": "wealth_index"
          },
          {
            "entity": "Example region",
            "time": 2030,
            "capital_type": "produced",
            "opening_stock": 535,
            "investment": 58,
            "revaluation": 0,
            "depreciation": 23,
            "depletion": 0,
            "damages": 0,
            "expected_closing_stock": 570,
            "closing_stock": 570,
            "net_change": 35,
            "accounting_net_change": 35,
            "reconciliation_error": 0,
            "shadow_price": 1,
            "opening_value": 535,
            "closing_value": 570,
            "value_change": 35,
            "unit": "wealth_index"
          },
          {
            "entity": "Example region",
            "time": 2035,
            "capital_type": "produced",
            "opening_stock": 570,
            "investment": 62,
            "revaluation": 0,
            "depreciation": 25,
            "depletion": 0,
            "damages": 0,
            "expected_closing_stock": 607,
            "closing_stock": 607,
            "net_change": 37,
            "accounting_net_change": 37,
            "reconciliation_error": 0,
            "shadow_price": 1,
            "opening_value": 570,
            "closing_value": 607,
            "value_change": 37,
            "unit": "wealth_index"
          }
        ],
        "meta": {
          "package_version": "0.7.0",
          "created_at": "2026-07-17T15:45:00Z",
          "row_count": 3,
          "reconciliation_tolerance": 1e-08
        }
      },
      "human": {
        "schema_version": "1.0.0",
        "id": "human-capital",
        "title": "Human capital account",
        "capital_type": "human",
        "unit": "wealth_index",
        "data": [
          {
            "entity": "Example region",
            "time": 2025,
            "capital_type": "human",
            "opening_stock": 400,
            "investment": 36,
            "revaluation": 0,
            "depreciation": 12,
            "depletion": 0,
            "damages": 0,
            "expected_closing_stock": 424,
            "closing_stock": 424,
            "net_change": 24,
            "accounting_net_change": 24,
            "reconciliation_error": 0,
            "shadow_price": 1.2,
            "opening_value": 480,
            "closing_value": 508.8,
            "value_change": 28.8,
            "unit": "wealth_index"
          },
          {
            "entity": "Example region",
            "time": 2030,
            "capital_type": "human",
            "opening_stock": 424,
            "investment": 39,
            "revaluation": 0,
            "depreciation": 13,
            "depletion": 0,
            "damages": 0,
            "expected_closing_stock": 450,
            "closing_stock": 450,
            "net_change": 26,
            "accounting_net_change": 26,
            "reconciliation_error": 0,
            "shadow_price": 1.2,
            "opening_value": 508.8,
            "closing_value": 540,
            "value_change": 31.2,
            "unit": "wealth_index"
          },
          {
            "entity": "Example region",
            "time": 2035,
            "capital_type": "human",
            "opening_stock": 450,
            "investment": 42,
            "revaluation": 0,
            "depreciation": 14,
            "depletion": 0,
            "damages": 0,
            "expected_closing_stock": 478,
            "closing_stock": 478,
            "net_change": 28,
            "accounting_net_change": 28,
            "reconciliation_error": 0,
            "shadow_price": 1.2,
            "opening_value": 540,
            "closing_value": 573.6,
            "value_change": 33.6,
            "unit": "wealth_index"
          }
        ],
        "meta": {
          "package_version": "0.7.0",
          "created_at": "2026-07-17T15:45:00Z",
          "row_count": 3,
          "reconciliation_tolerance": 1e-08
        }
      },
      "natural": {
        "schema_version": "1.0.0",
        "id": "natural-capital",
        "title": "Natural capital account",
        "capital_type": "natural",
        "unit": "wealth_index",
        "data": [
          {
            "entity": "Example region",
            "time": 2025,
            "capital_type": "natural",
            "opening_stock": 300,
            "investment": 12,
            "revaluation": 0,
            "depreciation": 0,
            "depletion": 8,
            "damages": 6,
            "expected_closing_stock": 298,
            "closing_stock": 298,
            "net_change": -2,
            "accounting_net_change": -2,
            "reconciliation_error": 0,
            "shadow_price": 1.5,
            "opening_value": 450,
            "closing_value": 447,
            "value_change": -3,
            "unit": "wealth_index"
          },
          {
            "entity": "Example region",
            "time": 2030,
            "capital_type": "natural",
            "opening_stock": 298,
            "investment": 14,
            "revaluation": 0,
            "depreciation": 0,
            "depletion": 9,
            "damages": 6,
            "expected_closing_stock": 297,
            "closing_stock": 297,
            "net_change": -1,
            "accounting_net_change": -1,
            "reconciliation_error": 0,
            "shadow_price": 1.5,
            "opening_value": 447,
            "closing_value": 445.5,
            "value_change": -1.5,
            "unit": "wealth_index"
          },
          {
            "entity": "Example region",
            "time": 2035,
            "capital_type": "natural",
            "opening_stock": 297,
            "investment": 16,
            "revaluation": 0,
            "depreciation": 0,
            "depletion": 9,
            "damages": 6,
            "expected_closing_stock": 298,
            "closing_stock": 298,
            "net_change": 1,
            "accounting_net_change": 1,
            "reconciliation_error": 0,
            "shadow_price": 1.5,
            "opening_value": 445.5,
            "closing_value": 447,
            "value_change": 1.5,
            "unit": "wealth_index"
          }
        ],
        "meta": {
          "package_version": "0.7.0",
          "created_at": "2026-07-17T15:45:00Z",
          "row_count": 3,
          "reconciliation_tolerance": 1e-08
        }
      }
    },
    "meta": {